[
  {
    "entity_id": "ba.ercot.north",
    "entity_type": "balancing_authority",
    "attributes": {
      "name": "North ERCOT Control Area",
      "reserve_margin_percent": 7
    },
    "created_at": "2026-03-23T11:01:00Z",
    "version": 1
  },
  {
    "entity_id": "generator.windfarm.07",
    "entity_type": "generator",
    "attributes": {
      "fuel_type": "wind",
      "available_mw": 210
    },
    "created_at": "2026-03-23T11:01:00Z",
    "version": 1
  },
  {
    "entity_id": "line.north-south.01",
    "entity_type": "transmission_line",
    "attributes": {
      "voltage_kv": 345,
      "status": "derated"
    },
    "created_at": "2026-03-23T11:02:00Z",
    "version": 1
  },
  {
    "entity_id": "substation.oak-138",
    "entity_type": "substation",
    "attributes": {
      "load_mw": 420,
      "critical_load": true
    },
    "created_at": "2026-03-23T11:02:00Z",
    "version": 1
  }
]
