[
  {
    "entity_id": "supplier.beta",
    "entity_type": "supplier",
    "attributes": {
      "name": "Beta Materials",
      "location": "Houston, TX"
    },
    "created_at": "2026-03-08T10:00:00Z",
    "version": 1
  },
  {
    "entity_id": "factory.acme.dallas",
    "entity_type": "factory",
    "attributes": {
      "name": "Acme Dallas Factory",
      "location": "Dallas, TX",
      "capacity_per_day": 1200
    },
    "created_at": "2026-03-08T10:00:00Z",
    "version": 1
  },
  {
    "entity_id": "shipment.88421",
    "entity_type": "shipment",
    "attributes": {
      "origin": "Houston, TX",
      "destination": "Dallas, TX",
      "material": "resin.grade-a"
    },
    "created_at": "2026-03-08T10:05:00Z",
    "version": 1
  }
]
