[
  {
    "entity_id": "airport.kord",
    "entity_type": "airport",
    "attributes": {
      "name": "Chicago O'Hare International",
      "icao": "KORD"
    },
    "created_at": "2026-03-09T08:01:00Z",
    "version": 1
  },
  {
    "entity_id": "runway.kord.10c-28c",
    "entity_type": "runway",
    "attributes": {
      "airport_id": "airport.kord",
      "designation": "10C/28C",
      "status": "closed"
    },
    "created_at": "2026-03-09T08:01:00Z",
    "version": 1
  },
  {
    "entity_id": "flight.ual2187",
    "entity_type": "flight",
    "attributes": {
      "call_sign": "UAL2187",
      "origin": "KSFO",
      "destination": "KORD",
      "fuel_buffer_minutes": 24
    },
    "created_at": "2026-03-09T08:02:00Z",
    "version": 1
  },
  {
    "entity_id": "sector.kord.arrival-north",
    "entity_type": "control_sector",
    "attributes": {
      "airport_id": "airport.kord",
      "sector_name": "Arrival North"
    },
    "created_at": "2026-03-09T08:02:00Z",
    "version": 1
  }
]
