[
  {
    "entity_id": "binding.digital-twin.power-grid.0001",
    "entity_type": "dt_host_binding",
    "attributes": {
      "host_adapter_id": "adapter-power-grid",
      "binding_mode": "advisory_overlay",
      "proof_stage": "DT-M2"
    },
    "created_at": "2026-03-23T12:01:00Z",
    "version": 1
  },
  {
    "entity_id": "binding.digital-twin.city-ops.0002",
    "entity_type": "dt_host_binding",
    "attributes": {
      "host_adapter_id": "adapter-city-ops",
      "binding_mode": "advisory_overlay",
      "proof_stage": "DT-M3"
    },
    "created_at": "2026-03-23T12:02:00Z",
    "version": 1
  },
  {
    "entity_id": "overlay.digital-twin.power-grid",
    "entity_type": "dt_overlay_model",
    "attributes": {
      "host_domain": "power_grid",
      "risk_focus": "contingency_stability"
    },
    "created_at": "2026-03-23T12:02:30Z",
    "version": 1
  },
  {
    "entity_id": "overlay.digital-twin.city-ops",
    "entity_type": "dt_overlay_model",
    "attributes": {
      "host_domain": "city_ops",
      "risk_focus": "cross_agency_incident_response"
    },
    "created_at": "2026-03-23T12:03:00Z",
    "version": 1
  },
  {
    "entity_id": "feed.digital-twin.metro-mesh",
    "entity_type": "dt_signal_feed",
    "attributes": {
      "provider": "public-ops-mesh",
      "freshness_sla_minutes": 5
    },
    "created_at": "2026-03-23T12:03:30Z",
    "version": 1
  },
  {
    "entity_id": "control.digital-twin.metro-watchfloor",
    "entity_type": "dt_control_center",
    "attributes": {
      "review_board": "metro-overlay-board",
      "approval_scope": "cross_host_overlay"
    },
    "created_at": "2026-03-23T12:04:00Z",
    "version": 1
  }
]
